title,response,idx,model,profile,memory,action,capability_acquisition,social_science,natural_science,engineering,benchmark
SelfCheck,"In summary, the purpose and capabilities of quantum computing are significant advancements in computing technology that could revolutionize fields such as chemistry, materials science, artificial intelligence, and cryptography, among others. Its potential for solving complex problems that are currently beyond the reach of classical computers offers...",quantum_computing,tinyllama,,,,,,,,
Self-Refine,"Factual Response:

Quantum computing is a revolutionary technology that utilizes quantum mechanics to perform complex calculations much faster than classical computers. It harnesses the power of entanglement, which allows two particles to exist simultaneously as one object, and superposition, which allows them to be in multiple states simultaneousl...",quantum_computing,tinyllama,,,,Prompt Engineering,,,,
Tree-of-Thought (ToT),"As you're familiar with modern technology and concepts, we can now turn our attention to one of the most groundbreaking developments in the field of computer science, namely quantum computing. AI Assistant: Quantum computers are considered to be exponentially faster than classical computing devices due to their ability to carry out quantum operatio",quantum_computing,tinyllama,,,,,,,,
TPTU,"Factually speaking, quantum computing is a new type of computing technology that utilizes the intrinsic properties of matter to perform calculations at the subatomic level. The most significant advantage of quantum computing over traditional computing techniques is its ability to solve complex problems that are currently intractable for classical c...",quantum_computing,tinyllama,,"Hybrid,Read/Write",w/ Tools,Prompt Engineering,,,,
ChatCoT,"Quantum computing utilizes quantum bits (qubits) to perform computations at previously unimaginable speeds, which is the reason why it's known as ""the next big thing"" in science and technology. The key feature of quantum computing that sets it apart from classical computers is that qubits can exist in multiple states simultaneously, allowing for gr...",quantum_computing,tinyllama,,Unified,w/o Tools,,,,,
LLM4RL,"AI Assistant: Quantum computing is a revolutionary technology that enables the simulation of complex systems with entangled quantum states, leading to significant advancements in fields such as drug discovery, machine learning, and optimization. In essence, quantum computing allows for the efficient and accurate computation of complex problems invo...",quantum_computing,tinyllama,,,,,,,,
Inner Monologue,"Factual Response: Quantum computing, also known as quantum annealing or quantum simulation, is a revolutionary field in mathematics and physics that aims to simulate complex systems using quantum mechanics. It has been predicted since the 1920s and was first proposed by John von Neumann in the 1940s.

Internal Reasoning: The most significant obstac...",quantum_computing,tinyllama,,,w/o Tools,Prompt Engineering,,,Robotics & Embodied AI,
LLM+P,"Question: What are the benefits and applications of quantum computing?

Answer: Quantum computing is a revolutionary technology that can perform calculations using superposition and entanglement, which allows for faster and more efficient computation. It has enormous potential in fields such as cryptography, drug discovery, and deep learning. Here ...",quantum_computing,tinyllama,,,,,,,,
ReAct,"Factual response: Quantum computing is a new type of computation that utilizes the principles of quantum mechanics to perform calculations that are beyond the capabilities of classical computers. This technology offers significant advantages over traditional digital computers, including increased efficiency, speed, and scalability.

Brief overview:...",quantum_computing,tinyllama,,,w/ Tools,w/ Fine-tuning,,,,w/ Benchmark
LLM-Planner,"AI Assistant: Quantum computing is a subfield of physics that involves manipulating quantum states using complex algorithms and machines. It offers revolutionary possibilities for solving complex problems in fields such as medicine, chemistry, finance, and cryptography. In essence, quantum computing is based on the principles of quantum mechanics, ",quantum_computing,tinyllama,,,,,,,Robotics & Embodied AI,w/ Benchmark
Re-Prompting,"AI response: Quantum computing is a cutting-edge technology that allows for the simulation of quantum systems, such as atoms or molecules, on a computer's electronic hardware. It uses principles discovered by scientists from the late 19th century to perform computations that would be computationally impossible in classical computers.

Quantum compu...",quantum_computing,tinyllama,,,,,,,,
Chain of Thought (CoT),"Fact: Quantum computing is an area of computer science that focuses on exploiting the intrinsic properties of quantum mechanical systems for performing calculations that are beyond the capabilities of classical computers. This approach involves creating superconducting circuits and implementing qubits, or logical units, that can simultaneously exis...",quantum_computing,tinyllama,,,,,,,,
HuggingGPT,"AI: Quantum computing is an emerging field that involves applying quantum mechanics to solve complex problems for practical applications in various fields such as materials science, chemistry, and engineering. As per current research, quantum computers are expected to perform calculations up to 10^6 times faster than classical computers of similar ...",quantum_computing,tinyllama,,Unified,w/ Tools,,,,,w/ Benchmark
Zero-Shot CoT,"Fact: Quantum computing is a type of computing that operates on the principles of quantum mechanics, which are not fully understood by humans. The idea behind quantum computing is to simulate complex algorithms using qubits -Quantum bits- instead of classical ones. By manipulating qubits in ways that are only possible due to their quantum nature, q...",quantum_computing,tinyllama,,,,,,,,
